scheme_name,scheme_type,age_group,gender,social_category,annual_income_group,location,scheme_goal,eligibility,benefits,application_process,scheme_website,total_returns,time_duration,amount_to_be_paid,payment_interval,scheme_name_hi,scheme_name_mr,scheme_goal_hi,scheme_goal_mr,eligibility_hi,eligibility_mr,benefits_hi,benefits_mr,application_process_hi,application_process_mr,total_returns_hi,total_returns_mr,time_duration_hi,time_duration_mr
Sahara India Financial Inclusion Scheme,Private,All,All,All,All,Assam,Financial inclusion and savings,All citizens,Savings accounts with higher interest rates,Open account at Sahara branches or online,https://sahara.in,Interest rate 9-11%,Lifetime,,,सहारा भारतीय वित्तीय समावेशन योजना,सहारा इंडिया आर्थिक समावेश योजना,वित्तीय समावेश और बचत,आर्थिक समावेश आणि बचत,सभी नागरिक,सर्व नागरिक,उच्च ब्याज दरों के साथ बचत खाते,उच्च व्याज दरासह बचत खाती,सहारा शाखाओं या ऑनलाइन में खाता खोलें,सहारा शाखांमध्ये किंवा ऑनलाइन येथे खुले खाते,ब्याज दर 9-11%,व्याज दर 9-11%,जीवनभर,आजीवन
Rural India Microfinance Initiative,Private,19-60,All,All,Below Poverty Line,Jammu & Kashmir,Microfinance support for rural entrepreneurs,Rural micro-entrepreneurs,Microloans with flexible repayment terms,Apply at rural microfinance centers,https://ruralmicrofinance.in,Interest rate 16-22%,1-3 years,Interest plus principal,Monthly,ग्रामीण भारत माइक्रोफाइनेंस पहल,ग्रामीण भारत मायक्रोफायनान्स इनिशिएटिव्ह,ग्रामीण उद्यमियों के लिए माइक्रोफाइनेंस समर्थन,ग्रामीण उद्योजकांसाठी मायक्रोफायनान्स समर्थन,ग्रामीण सूक्ष्म उद्यमियों,ग्रामीण सूक्ष्म-उद्योजक,लचीले चुकौती की शर्तों के साथ माइक्रोलोन,लवचिक परतफेड अटींसह मायक्रोलोन्स,ग्रामीण माइक्रोफाइनेंस केंद्रों पर आवेदन करें,ग्रामीण मायक्रोफायनान्स सेंटरवर अर्ज करा,ब्याज दर 16-22%,व्याज दर 16-22%,1-3 साल,1-3 वर्षे
Vijaya Bank Digital Banking Initiative,Private,All,All,All,All,Bihar,Promote digital banking literacy,All urban residents,Digital banking education and support,Register online or at bank branches,https://vijayabank.co.in/digital,Interest rate 6-8%,,,,विजया बैंक डिजिटल बैंकिंग पहल,विजया बँक डिजिटल बँकिंग उपक्रम,डिजिटल बैंकिंग साक्षरता को बढ़ावा देना,डिजिटल बँकिंग साक्षरतेला प्रोत्साहन द्या,सभी शहरी निवासी,सर्व शहरी रहिवासी,अंकीय बैंकिंग शिक्षा और समर्थन,डिजिटल बँकिंग शिक्षण आणि समर्थन,ऑनलाइन या बैंक शाखाओं में पंजीकरण करें,ऑनलाईन किंवा बँक शाखांमध्ये नोंदणी करा,ब्याज दर 6-8%,वार्षिक परतावा 6-9%,,
Post Office Savings Schemes,Government,All,All,All,All,Tamil Nadu,Savings and small investments,All residents,Safe savings options with government backing,Visit local post office,https://indiapost.gov.in,Interest rate 4-7%,,,,डाकघर बचत योजनाएँ,पोस्ट ऑफिस बचत योजना,बचत और छोटे निवेश,बचत आणि लहान गुंतवणूक,सभी निवासी,सर्व रहिवासी,सरकारी समर्थन के साथ सुरक्षित बचत विकल्प,सरकारी पाठबळासह सुरक्षित बचत पर्याय,स्थानीय डाकघर पर जाएँ,स्थानिक पोस्ट ऑफिसला भेट द्या,ब्याज दर 4-7%,व्याज दर 4-7%,,
Indira Awas Yojana,Government,All,All,All,Below Poverty Line,Kerala,Housing for Economically Weaker Sections,"Low-income families, BPL cardholders","Affordable housing units, Subsidies",Apply through local government offices or online portal,https://pmay.gov.in,Annual return 5-7%,Lifetime,Varies by scheme,,इंदिरा वॉच आउट योजना,इंदिरा योजना पहा,आर्थिक रूप से कमजोर वर्गों के लिए आवास,आर्थिकदृष्ट्या कमकुवत विभागांसाठी घरे,"कम आय वाले परिवार, बीपीएल कार्डधारक","कमी उत्पन्न असलेली कुटुंबे, बीपीएल कार्डधारक","किफायती आवास इकाइयाँ, सब्सिडी","परवडणारी गृहनिर्माण युनिट्स, अनुदान",स्थानीय सरकारी कार्यालयों या ऑनलाइन पोर्टल के माध्यम से आवेदन करें,स्थानिक सरकारी कार्यालये किंवा ऑनलाइन पोर्टलद्वारे अर्ज करा,ब्याज दर 7-10%,व्याज दर 6-8%,जीवनभर,आजीवन
Pradhan Mantri Jan Dhan Yojana,Government,All,All,All,All,Jharkhand,"Financial Inclusion, Banking Access","Open to all residents, no minimum income","Basic banking account, RuPay debit card, Accident insurance",Open a bank account at participating banks or through mobile app,https://pmjdy.gov.in,Interest rate 6-8%,,,,Pradhan Mantri Jan Dhan Yojana,प्रधान मंत्र जान धन योजना,"वित्तीय समावेशन, बैंकिंग पहुंच","आर्थिक समावेश, बँकिंग प्रवेश","सभी निवासियों के लिए खुला, कोई न्यूनतम आय नहीं","सर्व रहिवाशांसाठी खुले, किमान उत्पन्न नाही","बुनियादी बैंकिंग खाता, रूपे डेबिट कार्ड, दुर्घटना बीमा","मूलभूत बँकिंग खाते, रुपय डेबिट कार्ड, अपघात विमा",भाग लेने वाले बैंकों में या मोबाइल ऐप के माध्यम से एक बैंक खाता खोलें,सहभागी बँकांमध्ये किंवा मोबाइल अ‍ॅपद्वारे बँक खाते उघडा,वार्षिक रिटर्न 5-7%,व्याज दर 10-15%,,
MUDRA Yojana,Government,19-60,All,All,Below Poverty Line,Bihar,"Microcredit for Micro, Small and Medium Enterprises","Micro enterprise registration, Business plan","Loans up to 10 lakh INR, No collateral required","Apply through banks, NBFCs, or online portals",https://mudra.org.in,Interest rate 8-12% depending on bank,Up to 5 years,Interest plus principal,Monthly,MUDRA Yojana,पैसा योजना,"सूक्ष्म, छोटे और मध्यम उद्यमों के लिए microcredit","सूक्ष्म, लघु आणि मध्यम उद्योगांसाठी मायक्रोक्रेडिट","सूक्ष्म उद्यम पंजीकरण, व्यवसाय योजना","सूक्ष्म एंटरप्राइझ नोंदणी, व्यवसाय योजना","10 लाख तक के ऋण, कोई संपार्श्विक आवश्यक नहीं","10 लाखांपर्यंतचे कर्ज, कोणतेही दुय्यम आवश्यक नाही","बैंकों, एनबीएफसी या ऑनलाइन पोर्टल्स के माध्यम से आवेदन करें","बँका, एनबीएफसी किंवा ऑनलाइन पोर्टलद्वारे अर्ज करा",बैंक के आधार पर ब्याज दर 8-12%,बँकेवर अवलंबून व्याज दर 8-12%,5 साल तक,5 वर्षांपर्यंत
Sukanya Samriddhi Yojana,Government,0-18,Female,All,All,Tamil Nadu,Child Girl Child Savings Plan,Parents or guardians of girl child,"Tax savings, Attractive interest rate, Maturity benefit",Apply at post office or banks,https://sukanya-official.gov.in,Interest rate 7-8% compounded annually,21 years or till girl turns 18,"Minimum 250 INR, Maximum 1.5 lakh INR annually",Monthly or Annually,Sukanya Samriddhi Yojana,सुकन्या साम्रिधी योजना,बाल बाल बाल बचत योजना,बाल मुलगी बाल बचत योजना,लड़की के माता -पिता या अभिभावक बच्चे,पालक किंवा मुलगी मुलाचे पालक,"कर बचत, आकर्षक ब्याज दर, परिपक्वता लाभ","कर बचत, आकर्षक व्याज दर, परिपक्वता लाभ",डाकघर या बैंकों पर आवेदन करें,पोस्ट ऑफिस किंवा बँकांवर अर्ज करा,ब्याज दर 7-8% सालाना,व्याज दर दरवर्षी 7-8% चक्रवाढ,21 साल या जब तक लड़की 18 साल की हो जाती है,21 वर्षे किंवा मुलगी 18 वर्षांची होईपर्यंत
Stand Up India Scheme,Government,All,All,SC,Below Poverty Line,Western India,Entrepreneurship and Microenterprise Development,"SC/ST entrepreneurs, Business plan, Bank approval","Loans up to 1 crore INR, Credit guarantee",Apply through designated bank branches,https://standupindia.gov.in,Interest rate 9-12%,Up to 7 years,Interest plus principal,Monthly,स्टैंड अप इंडिया स्कीम,उभे रहा भारत योजना,उद्यमशीलता और माइक्रोएन्ट्रिस विकास,उद्योजकता आणि मायक्रोएन्टरप्राइझ डेव्हलपमेंट,"SC/ST उद्यमी, व्यवसाय योजना, बैंक अनुमोदन","एससी/एसटी उद्योजक, व्यवसाय योजना, बँक मंजुरी","1 करोड़ INR, क्रेडिट गारंटी तक ऋण","1 कोटी पर्यंत कर्ज, पत हमी",निर्दिष्ट बैंक शाखाओं के माध्यम से आवेदन करें,नियुक्त केलेल्या बँक शाखांद्वारे अर्ज करा,ब्याज दर 9-12%,व्याज दर 9-12%,7 साल तक,7 वर्षांपर्यंत
Digital India Scheme,Government,All,All,All,All,Central India,Digital Literacy and Infrastructure Development,"All citizens, institutions","Access to digital services, Infrastructure upgrades",Register online or via local government offices,https://digitalindia.gov.in,Interest rate 5-8%,Ongoing,,,अंकीय भारतीय योजना,डिजिटल इंडिया योजना,डिजिटल साक्षरता और बुनियादी ढांचा विकास,डिजिटल साक्षरता आणि पायाभूत सुविधा विकास,"सभी नागरिक, संस्थान","सर्व नागरिक, संस्था","डिजिटल सेवाओं तक पहुंच, बुनियादी ढांचा उन्नयन","डिजिटल सेवांमध्ये प्रवेश, पायाभूत सुविधा अपग्रेड",ऑनलाइन या स्थानीय सरकारी कार्यालयों के माध्यम से पंजीकरण करें,ऑनलाइन किंवा स्थानिक सरकारी कार्यालयांद्वारे नोंदणी करा,वार्षिक रिटर्न 6-9%,व्याज दर 5-8%,चल रहे,चालू आहे
Bajaj Finserv EMI Card,Private,18-60,All,All,Middle,Assam,"Consumer Finance, Easy EMIs","Income proof, Identity proof","Interest-free EMIs, Instant approval",Apply online or at stores,https://bajajfinserv.in,Interest as per EMI plan,Varies by purchase,Depends on purchase,Monthly,Bajaj Finserv EMI Card,बजाज फिनसर्वेबल कार्ड,"उपभोक्ता वित्त, आसान ईएमआई","ग्राहक वित्त, इझी इमिस","आय प्रमाण, पहचान प्रमाण","उत्पन्नाचा पुरावा, ओळख पुरावा","ब्याज-मुक्त ईएमआई, त्वरित अनुमोदन","व्याज-मुक्त ईएमआय, त्वरित मंजुरी",ऑनलाइन या दुकानों पर आवेदन करें,ऑनलाइन किंवा स्टोअरमध्ये अर्ज करा,ईएमआई योजना के अनुसार ब्याज,ईएमआय योजनेनुसार व्याज,खरीद से भिन्न होता है,खरेदीद्वारे बदलते
HDFC Bank Insta Loan,Private,21-60,All,All,Upper,Karnataka,"Personal Loans, Quick Disbursal","Bank account, Income proof","Quick approval, No collateral needed",Apply online or at bank branches,https://hdfcbank.com,Interest rate 10-15%,Up to 3 years,Interest plus principal,Monthly,HDFC बैंक इंस्टा ऋण,एचडीएफसी बँक इंस्टा कर्ज,"व्यक्तिगत ऋण, त्वरित डिस्बर्सल","वैयक्तिक कर्ज, द्रुत वितरण","बैंक खाता, आय प्रमाण","बँक खाते, उत्पन्न पुरावा","त्वरित अनुमोदन, कोई संपार्श्विक की आवश्यकता नहीं है","द्रुत मंजुरी, कोणत्याही दुय्यम आवश्यक नाही",ऑनलाइन या बैंक शाखाओं में आवेदन करें,ऑनलाईन किंवा बँक शाखांमध्ये अर्ज करा,ब्याज दर 10-15%,व्याज दर 10-15%,3 साल तक,3 वर्षांपर्यंत
Kotak Mahindra Credit Card,Private,18-65,All,All,Middle,Madhya Pradesh,"Consumer Credit, Convenience Payments","Income proof, Credit check","Credit limit up to 5 lakh INR, Rewards & Offers",Apply online or at branch,https://kotak.com,Interest on outstanding balance,,N/A or minimum payment due,Monthly,कोटक महिंद्रा क्रेडिट कार्ड,कोटक महिंद्रा क्रेडिट कार्ड,"उपभोक्ता ऋण, सुविधा भुगतान","ग्राहक पत, सोयीची देयके","आय प्रमाण, क्रेडिट चेक","उत्पन्नाचा पुरावा, पत धना","क्रेडिट सीमा 5 लाख तक, पुरस्कार और ऑफ़र","क्रेडिट मर्यादा 5 लाखांपर्यंतची मर्यादा, बक्षिसे आणि ऑफर",ऑनलाइन या शाखा में आवेदन करें,ऑनलाईन किंवा शाखेत अर्ज करा,बकाया राशि पर ब्याज,थकबाकीवरील व्याज,,
Paytm Payments Bank Account,Private,18-60,All,All,Middle,Telangana,"Digital Banking, Payments","KYC compliant, Resident of India","Zero balance account, Fast transactions",Apply online or at Paytm store,https://paytm.com,Interest rate 5-8%,,,,भुगतान बैंक खाता,पेटीएम पेमेंट बँक खाते,"अंकीय बैंकिंग, भुगतान","डिजिटल बँकिंग, देयके","KYC आज्ञाकारी, भारत के निवासी","केवायसी अनुपालन, भारतातील रहिवासी","शून्य शेष खाता, तेजी से लेनदेन","शून्य शिल्लक खाते, वेगवान व्यवहार",ऑनलाइन या पेटीएम स्टोर पर आवेदन करें,ऑनलाईन किंवा पेटीएम स्टोअरवर अर्ज करा,वार्षिक रिटर्न 5-7%,व्याज दर 6-8%,,
LIC Micro Insurance Scheme,Private,18-60,All,All,Below Poverty Line,Goa,Micro Insurance Coverage,"Low-income individuals, rural residents","Affordable insurance premiums, Coverage against common risks",Apply at LIC branches or via agents,https://licindia.in,Interest rate 5-8%,,Premium varies,Monthly,लाइसेंस सूक्ष्म बीमा योजना,परवाना मायक्रो विमा योजना,सूक्ष्म बीमा कवरेज,सूक्ष्म विमा संरक्षण,"कम आय वाले व्यक्ति, ग्रामीण निवासी","कमी उत्पन्न असणारी व्यक्ती, ग्रामीण रहिवासी","सस्ती बीमा प्रीमियम, सामान्य जोखिमों के खिलाफ कवरेज","परवडणारे विमा प्रीमियम, सामान्य जोखमीविरूद्ध कव्हरेज",LIC शाखाओं में या एजेंटों के माध्यम से आवेदन करें,एलआयसी शाखांमध्ये किंवा एजंट्सद्वारे अर्ज करा,ब्याज दर 8-12%,वार्षिक परतावा 6-9%,,
National Rural Employment Guarantee Act (MGNREGA),Government,18-60,All,All,Below Poverty Line,Bihar,Employment Generation,"All rural households, registered under scheme","Wage employment, Skill development",Register at local employment office,https://nrega.nic.in,Interest rate 8-12%,,Wages as per government rates,Weekly,राष्ट्रीय ग्रामीण रोजगार गारंटी अधिनियम (MGNREGRA),राष्ट्रीय ग्रामीण रोजगार हमी कायदा (एमजीएनरेगा),रोजगार सृजन,रोजगार निर्मिती,"सभी ग्रामीण परिवार, योजना के तहत पंजीकृत","सर्व ग्रामीण घरगुती, योजनेंतर्गत नोंदणीकृत","मजदूरी रोजगार, कौशल विकास","वेतन रोजगार, कौशल्य विकास",स्थानीय रोजगार कार्यालय में पंजीकरण,स्थानिक रोजगार कार्यालयात नोंदणी करा,वार्षिक रिटर्न 4-6%,व्याज दर 7-10%,,
Retirement Benefit Scheme (NPS),Government,60+,All,All,All,Central India,Pension Security,"All citizens, mandatory for government employees","Monthly pension, Tax benefits",Register online or through authorized agents,https://npsindia.in,"Interest rates vary, maturity value depends on contributions",Lifetime,Depends on contributions and interest,Monthly,सेवानिवृत्ति लाभ योजना (एनपी),सेवानिवृत्ती लाभ योजना (एनपीएस),पेंशन प्रतिभूति,पेन्शन सुरक्षा,"सभी नागरिक, सरकारी कर्मचारियों के लिए अनिवार्य","सर्व नागरिक, सरकारी कर्मचार्‍यांसाठी अनिवार्य","मासिक पेंशन, कर लाभ","मासिक पेन्शन, कर लाभ",ऑनलाइन या अधिकृत एजेंटों के माध्यम से पंजीकरण करें,ऑनलाइन किंवा अधिकृत एजंट्सद्वारे नोंदणी करा,"ब्याज दरें भिन्न होती हैं, परिपक्वता मूल्य योगदान पर निर्भर करता है","व्याज दर भिन्न असतात, परिपक्वता मूल्य योगदानावर अवलंबून असते",जीवनभर,आजीवन
Mutual Funds SIP,Private,19-65,All,All,Middle,Tamil Nadu,"Investment, Wealth Growth","KYC compliant, Income proof","Potential higher returns, Diversified portfolio",Apply through mutual fund platforms or banks,https://mfplatform.com,Average 12-15% annual returns,"Flexible, typically 5+ years",Minimum 500 INR per month,Monthly,म्यूचुअल फंड सिप,म्युच्युअल फंड एसआयपी,"निवेश, धन वृद्धि","गुंतवणूक, संपत्ती वाढ","KYC आज्ञाकारी, आय प्रमाण","केवायसी अनुपालन, उत्पन्न पुरावा","संभावित उच्च रिटर्न, विविध पोर्टफोलियो","संभाव्य उच्च परतावा, वैविध्यपूर्ण पोर्टफोलिओ",म्यूचुअल फंड प्लेटफार्मों या बैंकों के माध्यम से आवेदन करें,म्युच्युअल फंड प्लॅटफॉर्म किंवा बँकांद्वारे अर्ज करा,औसत 12-15% वार्षिक रिटर्न,सरासरी 12-15% वार्षिक परतावा,"लचीला, आमतौर पर 5+ वर्ष","लवचिक, सामान्यत: 5+ वर्षे"
LIC New Endowment Plan,Private,18-60,All,All,Upper,Eastern India,"Life Insurance, Savings","Age 18-60, KYC compliant","Life cover, Maturity benefits, Tax benefits",Apply at LIC branches or online,https://licindia.in,"Maturity amount varies, interest rate around 6-8%",15-20 years,Premium varies based on plan,Monthly or Yearly,लाइसेंस नई बंदोबस्ती योजना,नवीन एन्डॉवमेंट योजना लायक,"जीवन बीमा, बचत","जीवन विमा, बचत","आयु 18-60, KYC आज्ञाकारी","वय 18-60, केवायसी अनुपालन","जीवन कवर, परिपक्वता लाभ, कर लाभ","लाइफ कव्हर, परिपक्वता लाभ, कर लाभ",LIC शाखाओं या ऑनलाइन पर आवेदन करें,एलआयसी शाखांमध्ये किंवा ऑनलाईन अर्ज करा,"परिपक्वता राशि भिन्न होती है, ब्याज दर लगभग 6-8%","परिपक्वता रक्कम बदलते, व्याज दर सुमारे 6-8%",15-20 वर्ष,15-20 वर्षे
