scheme_name,scheme_type,age_group,gender,social_category,annual_income_group,location,scheme_goal,eligibility,benefits,application_process,scheme_website,total_returns,time_duration,amount_to_be_paid,payment_interval,scheme_name_hi,scheme_name_mr,scheme_goal_hi,scheme_goal_mr,eligibility_hi,eligibility_mr,benefits_hi,benefits_mr,application_process_hi,application_process_mr,total_returns_hi,total_returns_mr,time_duration_hi,time_duration_mr
ICICI Bank Financial Literacy Program,Private,All,All,All,All,Kerala,Financial literacy and awareness,"All age groups, no prior eligibility","Workshops, training sessions, online resources",Register online or through partner institutions,https://icicibank.com/financial-literacy,Annual return 6-9%,Ongoing,,,आईसीआईसीआई बैंक वित्तीय साक्षरता कार्यक्रम,आयसीआयसीआय बँक आर्थिक साक्षरता कार्यक्रम,वित्तीय साक्षरता और जागरूकता,आर्थिक साक्षरता आणि जागरूकता,"सभी आयु समूह, कोई पूर्व पात्रता नहीं","सर्व वयोगट, पूर्वीची पात्रता नाही","कार्यशालाएं, प्रशिक्षण सत्र, ऑनलाइन संसाधन","कार्यशाळा, प्रशिक्षण सत्र, ऑनलाइन संसाधने",ऑनलाइन या भागीदार संस्थानों के माध्यम से पंजीकरण करें,ऑनलाइन किंवा भागीदार संस्थांद्वारे नोंदणी करा,ब्याज दर 10-15%,व्याज दर 5-8%,चल रहे,चालू आहे
LIC Micro Insurance Plan,Private,All,All,All,Below Poverty Line,West Bengal,Micro insurance coverage,All residents aged 18-65,"Affordable insurance plans, cash benefits",Apply online or through LIC agents,https://licindia.in,Interest rate 6-8%,,Varies by plan,"One-time, Monthly, Quarterly",लाइसेंस सूक्ष्म बीमा योजना,परवाना मायक्रो विमा योजना,सूक्ष्म बीमा कवरेज,सूक्ष्म विमा संरक्षण,18-65 वर्ष की आयु के सभी निवासी,18-65 वयोगटातील सर्व रहिवासी,"सस्ती बीमा योजनाएं, नकद लाभ","परवडणारी विमा योजना, रोख लाभ",ऑनलाइन या लाइसेंस एजेंटों के माध्यम से आवेदन करें,ऑनलाईन किंवा एलआयसी एजंट्सद्वारे अर्ज करा,ब्याज दर 9-13%,वार्षिक परतावा 5-7%,,
Rural Electrification Loan Scheme,Government,All,All,All,All,South India,Electrification and energy access,Rural households and entrepreneurs,Low-interest loans for energy projects,Apply at rural bank branches or online,https://ruralenergy.gov.in,Interest rate 9-12%,5-10 years,Variable,Monthly or Quarterly,ग्रामीण विद्युतीकरण ऋण योजना,ग्रामीण विद्युतीकरण कर्ज योजना,विद्युतीकरण और ऊर्जा पहुंच,विद्युतीकरण आणि उर्जा प्रवेश,ग्रामीण परिवार और उद्यमी,ग्रामीण घरे आणि उद्योजक,ऊर्जा परियोजनाओं के लिए कम ब्याज ऋण,उर्जा प्रकल्पांसाठी कमी व्याज कर्ज,ग्रामीण बैंक शाखाओं या ऑनलाइन पर आवेदन करें,ग्रामीण बँक शाखांमध्ये किंवा ऑनलाइन अर्ज करा,ब्याज दर 9-12%,व्याज दर 9-12%,5-10 वर्ष,5-10 वर्षे
Mutual Fund SIP Program,Private,19-60,All,All,Middle,Maharashtra,Long-term wealth creation,KYC compliant investors aged 18+,"Systematic investment plans, tax benefits",KYC registration via online portal or branch,https://mfindia.in,Average 10-15% annual return,,As per SIP plan,Monthly,म्यूचुअल फंड सिप प्रोग्राम,म्युच्युअल फंड एसआयपी कार्यक्रम,दीर्घकालिक धन सृजन,दीर्घकालीन संपत्ती निर्मिती,18+ वर्ष की आयु के KYC आज्ञाकारी निवेशक,18+ वयोगटातील केवायसी अनुपालन गुंतवणूकदार,"व्यवस्थित निवेश योजनाएं, कर लाभ","पद्धतशीर गुंतवणूक योजना, कर लाभ",ऑनलाइन पोर्टल या शाखा के माध्यम से KYC पंजीकरण,ऑनलाईन पोर्टल किंवा शाखेतून केवायसी नोंदणी,वार्षिक रिटर्न 5-7%,सरासरी 10-15% वार्षिक परतावा,,
Skill Development Loan Scheme,Government,19-35,All,OBC,Middle,Western India,Skill enhancement and employment,Bankable individuals aged 18-35,Low-interest loans for skill courses,Apply through designated banks or online,https://skills.gov.in,Interest rate 8-10%,1-5 years,Variable,Monthly or Quarterly,कौशल विकास ऋण योजना,कौशल्य विकास कर्ज योजना,कौशल वृद्धि और रोजगार,कौशल्य वाढ आणि रोजगार,18-35 वर्ष की आयु के बैंक योग्य व्यक्ति,18-35 वयोगटातील बँक करण्यायोग्य व्यक्ती,कौशल पाठ्यक्रमों के लिए कम-ब्याज ऋण,कौशल्य अभ्यासक्रमांसाठी कमी व्याज कर्ज,निर्दिष्ट बैंकों या ऑनलाइन के माध्यम से आवेदन करें,नियुक्त केलेल्या बँका किंवा ऑनलाइनद्वारे अर्ज करा,ब्याज दर 8-10%,व्याज दर 8-10%,1-5 साल,1-5 वर्षे
Women Entrepreneurs Support Scheme,Government,19-45,Female,All,Upper,Eastern India,Support women-led businesses,Women entrepreneurs with business plan,"Seed funding, mentorship, training",Application via government portal or local office,https://womenentrepreneurs.gov.in,Interest rate 8-12%,Ongoing,,,महिला उद्यमी समर्थन योजना,महिला उद्योजक समर्थन योजना,महिलाओं के नेतृत्व वाले व्यवसायों का समर्थन करें,महिलांच्या नेतृत्वाखालील व्यवसायांना समर्थन द्या,व्यवसाय योजना के साथ महिला उद्यमी,व्यवसाय योजनेसह महिला उद्योजक,"बीज धन, मेंटरशिप, प्रशिक्षण","बियाणे निधी, मार्गदर्शन, प्रशिक्षण",सरकारी पोर्टल या स्थानीय कार्यालय के माध्यम से आवेदन,सरकारी पोर्टल किंवा स्थानिक कार्यालयातून अर्ज,वार्षिक रिटर्न 4-6%,व्याज दर 9-13%,चल रहे,चालू आहे
Digital Payment Adoption Scheme,Government,All,All,All,All,Kerala,Promote digital transactions,All citizens with bank accounts,"Cashback offers, ease of digital payments",Enroll through bank or digital portal,https://digitalindia.gov.in,Interest rate 10-15%,Ongoing,,,अंकीय अदायगी दत्तक ग्रहण योजना,डिजिटल पेमेंट दत्तक योजना,डिजिटल लेनदेन को बढ़ावा देना,डिजिटल व्यवहारांना प्रोत्साहन द्या,बैंक अकाउंट वाले सभी नागरिक,बँक खाती असलेले सर्व नागरिक,"कैशबैक ऑफ़र, डिजिटल भुगतान में आसानी","कॅशबॅक ऑफर, डिजिटल पेमेंट्सची सुलभता",बैंक या डिजिटल पोर्टल के माध्यम से दाखिला,बँक किंवा डिजिटल पोर्टलद्वारे नोंदणी करा,ब्याज दर 10-15%,व्याज दर 8-12%,चल रहे,चालू आहे
Start-Up India Funding Support,Government,19-40,All,All,All,Gujarat,Support startup ventures,Startup registration and business plan,"Seed funding, mentorship, incubation",Apply via startup portal or partner banks,https://startuindia.gov.in,Annual return 5-7%,Ongoing,,,स्टार्ट-अप इंडिया फंडिंग सपोर्ट,स्टार्ट-अप इंडिया फंडिंग सपोर्ट,स्टार्टअप वेंचर्स का समर्थन करें,समर्थन स्टार्टअप उपक्रम,स्टार्टअप पंजीकरण और व्यवसाय योजना,स्टार्टअप नोंदणी आणि व्यवसाय योजना,"बीज वित्त पोषण, मेंटरशिप, ऊष्मायन","बियाणे निधी, मार्गदर्शन, उष्मायन",स्टार्टअप पोर्टल या पार्टनर बैंकों के माध्यम से आवेदन करें,स्टार्टअप पोर्टल किंवा भागीदार बँकांद्वारे अर्ज करा,ब्याज दर 10-15%,वार्षिक परतावा 4-6%,चल रहे,चालू आहे
Vikaspedia Financial Literacy Campaign,Government,All,All,All,All,Uttar Pradesh,Financial literacy awareness,All citizens,"Educational resources, awareness sessions","Access online resources, participate in workshops",https://vikaspedia.in,Annual return 6-9%,Ongoing,,,विक्सपीडिया फाइनेंशियल साक्षरता अभियान,विकासिया आर्थिक साक्षरता मोहीम,वित्तीय साक्षरता जागरूकता,आर्थिक साक्षरता जागरूकता,सभी नागरिक,सर्व नागरिक,"शैक्षिक संसाधन, जागरूकता सत्र","शैक्षणिक संसाधने, जागरूकता सत्र","ऑनलाइन संसाधनों तक पहुंचें, कार्यशालाओं में भाग लें","ऑनलाइन संसाधनांमध्ये प्रवेश करा, कार्यशाळांमध्ये भाग घ्या",ब्याज दर 10-15%,व्याज दर 10-15%,चल रहे,चालू आहे
Pradhan Mantri Jan Dhan Yojana,Government,19-35,All,All,Below Poverty Line,Jammu & Kashmir,Financial Inclusion and Banking Access,Open to all citizens of India with valid documents,"Free basic banking accounts, overdraft facilities",Visit a bank branch or apply online with ID proof,https://pmjdy.gov.in/,Interest rate 9-13%,,,,Pradhan Mantri Jan Dhan Yojana,प्रधान मंत्र जान धन योजना,वित्तीय समावेशन और बैंकिंग पहुंच,आर्थिक समावेश आणि बँकिंग प्रवेश,वैध दस्तावेजों के साथ भारत के सभी नागरिकों के लिए खुला,वैध कागदपत्रांसह भारताच्या सर्व नागरिकांसाठी खुला,"नि: शुल्क मूल बैंकिंग खाते, ओवरड्राफ्ट सुविधाएं","विनामूल्य मूलभूत बँकिंग खाती, ओव्हरड्राफ्ट सुविधा",एक बैंक शाखा पर जाएँ या आईडी प्रूफ के साथ ऑनलाइन आवेदन करें,बँक शाखेत भेट द्या किंवा आयडी पुराव्यासह ऑनलाइन अर्ज करा,वार्षिक रिटर्न 6-9%,वार्षिक परतावा 4-6%,,
Microcredit for Women,Private,19-60,Female,OBC,Below Poverty Line,Rural Areas,Microcredit for Entrepreneurship,"Women aged 19-60 from OBC communities, with a viable business plan","Loan facility with low interest, business training support",Online application via partner NGO or bank,https://microcreditwomen.org/,Interest rate 12-15%,5 years,"Up to 50,000 INR",Monthly,महिलाओं के लिए microcredit,महिलांसाठी मायक्रोक्रेडिट,उद्यमशीलता के लिए microcredit,उद्योजकतेसाठी मायक्रोक्रेडिट,एक व्यवहार्य व्यवसाय योजना के साथ ओबीसी समुदायों से 19-60 वर्ष की आयु की महिलाएं,व्यवहार्य व्यवसाय योजनेसह ओबीसी समुदायांमधून 19-60 वयोगटातील महिला,"कम ब्याज, व्यापार प्रशिक्षण सहायता के साथ ऋण सुविधा","कमी व्याज, व्यवसाय प्रशिक्षण समर्थनासह कर्ज सुविधा",पार्टनर एनजीओ या बैंक के माध्यम से ऑनलाइन आवेदन,भागीदार स्वयंसेवी संस्था किंवा बँक मार्गे ऑनलाइन अनुप्रयोग,ब्याज दर 12-15%,व्याज दर 12-15%,5 साल,5 वर्षे
Senior Citizens Pension Scheme,Government,60+,All,All,Middle,Delhi,Pension Support,Citizens aged 60+ with income below specified threshold,"Monthly pension, health checkups",Apply at local government offices or online,https://seniorspension.gov.in/,Interest rate 9-13%,Lifetime,2000 INR/month,Monthly,वरिष्ठ नागरिक पेंशन योजना,ज्येष्ठ नागरिक पेन्शन योजना,पेंशन समर्थन,पेन्शन समर्थन,निर्दिष्ट सीमा से नीचे आय के साथ 60+ आयु वर्ग के नागरिक,निर्दिष्ट उंबरठा खाली उत्पन्नासह 60+ वयोगटातील नागरिक,"मासिक पेंशन, स्वास्थ्य चेकअप","मासिक पेन्शन, आरोग्य तपासणी",स्थानीय सरकारी कार्यालयों या ऑनलाइन पर आवेदन करें,स्थानिक सरकारी कार्यालयांमध्ये किंवा ऑनलाइन अर्ज करा,ब्याज दर 5-8%,वार्षिक परतावा 5-7%,जीवनभर,आजीवन
Skill Development Loan Scheme,Private,19-35,All,All,Middle,Bihar,Skill Development and Education Financing,Individuals aged 19-35 pursuing vocational courses,"Loan at low interest, free training resources",Online application and interview at partner banks,https://skillloan.org/,Interest rate 10-14%,3 years,"Up to 1,00,000 INR",Monthly,कौशल विकास ऋण योजना,कौशल्य विकास कर्ज योजना,कौशल विकास और शिक्षा वित्तपोषण,कौशल्य विकास आणि शिक्षण वित्तपुरवठा,19-35 वर्ष की आयु के व्यक्ति व्यावसायिक पाठ्यक्रमों का पीछा करते हैं,19-35 वयोगटातील व्यक्ती व्यावसायिक अभ्यासक्रमांचा पाठपुरावा करतात,"कम ब्याज पर ऋण, नि: शुल्क प्रशिक्षण संसाधन","कमी व्याज, विनामूल्य प्रशिक्षण संसाधनांवर कर्ज",साझेदार बैंकों में ऑनलाइन आवेदन और साक्षात्कार,भागीदार बँकांवर ऑनलाइन अर्ज आणि मुलाखत,ब्याज दर 10-14%,व्याज दर 10-14%,3 वर्ष,3 वर्षे
Rural Housing Scheme,Government,All,All,All,Below Poverty Line,Rural Areas,Affordable Housing,"Rural households below poverty line, land ownership proof","Interest subsidy, low-cost housing loans",Apply through local Panchayat or online,https://ruralhousing.gov.in/,Interest rate 10-15%,15-20 years,Depends on loan amount,Monthly,ग्रामीण आवास योजना,ग्रामीण गृहनिर्माण योजना,किफायती आवास,परवडणारी घरे,"गरीबी रेखा से नीचे के ग्रामीण परिवार, भूमि स्वामित्व प्रमाण","दारिद्र्य रेषेखालील ग्रामीण घरे, जमीन मालकीचा पुरावा","ब्याज सब्सिडी, कम लागत वाले आवास ऋण","व्याज अनुदान, कमी किमतीच्या गृहनिर्माण कर्ज",स्थानीय पंचायत या ऑनलाइन के माध्यम से आवेदन करें,स्थानिक पंचायत किंवा ऑनलाइनद्वारे अर्ज करा,ब्याज दर 9-13%,व्याज दर 5-8%,15-20 वर्ष,15-20 वर्षे
Educational Savings Plan,Private,0-18,All,All,All,South India,Educational Savings and Planning,Parents or guardians of children aged 0-18,"Tax benefits, higher interest rates, education grants",Open an account at partner banks or financial institutions,https://educationsavings.com/,Interest rate 6-8% plus grants,Lifetime or until child completes education,"Variable, starting from 500 INR/month",Monthly,शैक्षिक बचत योजना,शैक्षणिक बचत योजना,शैक्षिक बचत और योजना,शैक्षणिक बचत आणि नियोजन,0-18 वर्ष की आयु के बच्चों के माता-पिता या संरक्षक,0-18 वयोगटातील मुलांचे पालक किंवा पालक,"कर लाभ, उच्च ब्याज दर, शिक्षा अनुदान","कर लाभ, उच्च व्याज दर, शिक्षण अनुदान",भागीदार बैंकों या वित्तीय संस्थानों में एक खाता खोलें,भागीदार बँका किंवा वित्तीय संस्थांवर खाते उघडा,ब्याज दर 6-8% प्लस अनुदान,व्याज दर 6-8% अधिक अनुदान,जीवनकाल या जब तक बच्चा शिक्षा पूरा नहीं करता है,आजीवन किंवा मूल शिक्षण पूर्ण होईपर्यंत
Health Insurance for Poor Families,Government,All,All,SC,Below Poverty Line,Eastern India,Health Coverage,"Families below poverty line, identified through local authorities","Free or subsidized health insurance, hospital coverage",Application through local health offices or online,https://healthcover.gov.in/,Interest rate 8-12%,1 year renewable,,,गरीब परिवारों के लिए स्वास्थ्य बीमा,गरीब कुटुंबांसाठी आरोग्य विमा,स्वास्थ्य कवरेज,आरोग्य कव्हरेज,"गरीबी रेखा से नीचे के परिवार, स्थानीय अधिकारियों के माध्यम से पहचाने जाते हैं",स्थानिक अधिका by ्यांद्वारे ओळखल्या गेलेल्या दारिद्र्य रेषेच्या खाली असलेली कुटुंबे,"नि: शुल्क या सब्सिडी वाले स्वास्थ्य बीमा, अस्पताल कवरेज","विनामूल्य किंवा अनुदानित आरोग्य विमा, हॉस्पिटल कव्हरेज",स्थानीय स्वास्थ्य कार्यालयों या ऑनलाइन के माध्यम से आवेदन,स्थानिक आरोग्य कार्यालये किंवा ऑनलाइनद्वारे अर्ज,ब्याज दर 5-8%,व्याज दर 5-8%,1 वर्ष नवीकरणीय,1 वर्ष नूतनीकरणयोग्य
Startup India Fund,Government,19-35,All,All,Middle,Urban,Support for Startups and Innovation,"Registered startups, innovative ideas","Funding grants, mentorship, incubation support",Online application through Startup India portal,https://startupindia.gov.in/,Interest rate 9-13%,,,,स्टार्टअप इंडिया फंड,स्टार्टअप इंडिया फंड,स्टार्टअप और नवाचार के लिए समर्थन,स्टार्टअप्स आणि इनोव्हेशनसाठी समर्थन,"पंजीकृत स्टार्टअप, अभिनव विचार","नोंदणीकृत स्टार्टअप्स, नाविन्यपूर्ण कल्पना","फंडिंग अनुदान, मेंटरशिप, इनक्यूबेशन सपोर्ट","वित्तपुरवठा अनुदान, मार्गदर्शन, उष्मायन समर्थन",स्टार्टअप इंडिया पोर्टल के माध्यम से ऑनलाइन आवेदन,स्टार्टअप इंडिया पोर्टलद्वारे ऑनलाइन अर्ज,वार्षिक रिटर्न 6-9%,व्याज दर 8-12%,,
