scheme_name,scheme_type,age_group,gender,social_category,annual_income_group,location,scheme_goal,eligibility,benefits,application_process,scheme_website,total_returns,time_duration,amount_to_be_paid,payment_interval,scheme_name_hi,scheme_name_mr,scheme_goal_hi,scheme_goal_mr,eligibility_hi,eligibility_mr,benefits_hi,benefits_mr,application_process_hi,application_process_mr,total_returns_hi,total_returns_mr,time_duration_hi,time_duration_mr
Startup India Loan Scheme,Government,19-35,All,All,Upper,Goa,Startup Funding and Business Growth,Registered startups and entrepreneurs,"Loan support, mentorship, subsidies",Online application portal,http://startupindia.gov.in,"Interest rate 8-10%, repayment over 3-7 years",3-7 years,,,स्टार्टअप भारत ऋण योजना,स्टार्टअप इंडिया कर्ज योजना,स्टार्टअप फंडिंग और व्यवसाय वृद्धि,स्टार्टअप निधी आणि व्यवसाय वाढ,पंजीकृत स्टार्टअप और उद्यमी,नोंदणीकृत स्टार्टअप्स आणि उद्योजक,"ऋण सहायता, मेंटरशिप, सब्सिडी","कर्ज समर्थन, मार्गदर्शन, अनुदान",ऑनलाइन आवेदन पोर्टल,ऑनलाइन अनुप्रयोग पोर्टल,"ब्याज दर 8-10%, 3-7 वर्षों में चुकौती","व्याज दर 8-10%, 3-7 वर्षांची परतफेड",3-7 साल,3-7 वर्षे
National Digital Payments Mission,Government,All,All,All,All,Kerala,Promote Digital Transactions,All residents,"Cashback offers, digital transaction facilities",Register online or at partner outlets,http://digitalpayments.in,Annual return 5-7%,Ongoing,,,राष्ट्रीय अंकीय भुगतान मिशन,राष्ट्रीय डिजिटल पेमेंट्स मिशन,डिजिटल लेनदेन को बढ़ावा देना,डिजिटल व्यवहारांना प्रोत्साहन द्या,सभी निवासी,सर्व रहिवासी,"कैशबैक ऑफ़र, डिजिटल लेनदेन सुविधाएं","कॅशबॅक ऑफर, डिजिटल व्यवहार सुविधा",ऑनलाइन या पार्टनर आउटलेट्स पर रजिस्टर करें,ऑनलाईन किंवा भागीदार दुकानात नोंदणी करा,ब्याज दर 7-10%,व्याज दर 9-13%,चल रहे,चालू आहे
Pradhan Mantri Awas Yojana (PMAY),Government,19-60,All,All,Below Poverty Line,Urban and Rural across India,Housing for Economically Weaker Sections,Income less than INR 3 lakh/year and family with no pucca house,Subsidized housing loans and financial assistance,Online application through official portal or local bank branches,https://pmay.gov.in,Annual return 4-6%,Lifetime,,,Pradhan Mantri Awas Yojana (PMAY),प्रधान मंत्री आवास योजना (पीएम),आर्थिक रूप से कमजोर वर्गों के लिए आवास,आर्थिकदृष्ट्या कमकुवत विभागांसाठी घरे,INR 3 लाख/वर्ष से कम आय और कोई Pucca घर वाला परिवार,आयएनआर 3 लाख/वर्षापेक्षा कमी उत्पन्न आणि पक्का हाऊस नसलेले कुटुंब,सब्सिडी वाले आवास ऋण और वित्तीय सहायता,अनुदानित गृहनिर्माण कर्जे आणि आर्थिक सहाय्य,आधिकारिक पोर्टल या स्थानीय बैंक शाखाओं के माध्यम से ऑनलाइन आवेदन,अधिकृत पोर्टल किंवा स्थानिक बँक शाखांद्वारे ऑनलाइन अर्ज,ब्याज दर 6-8%,व्याज दर 5-8%,जीवनभर,आजीवन
Sukanya Samriddhi Yojana,Government,0-18,Female,All,All,Western India,Child Education & Marriage Savings,Parents or guardians of a girl child,Interest benefits and tax savings,Online or bank branch application with birth certificate of girl,https://sukanyasamriddhi.nic.in,Interest rate approx 7.6% per annum,21 years or upon marriage of girl,"Minimum INR 250 annually, maximum INR 1.5 lakh per year",Annually,Sukanya Samriddhi Yojana,सुकन्या साम्रिधी योजना,बाल शिक्षा और विवाह बचत,बाल शिक्षण आणि विवाह बचत,एक लड़की के माता -पिता या अभिभावक,पालक किंवा मुलीचे पालक किंवा पालक,ब्याज लाभ और कर बचत,व्याज लाभ आणि कर बचत,लड़की के जन्म प्रमाण पत्र के साथ ऑनलाइन या बैंक शाखा आवेदन,मुलीच्या जन्म प्रमाणपत्रासह ऑनलाईन किंवा बँक शाखा अर्ज,ब्याज दर लगभग 7.6% प्रति वर्ष,व्याज दर दरवर्षी अंदाजे 7.6%,21 साल या लड़की की शादी पर,21 वर्षे किंवा मुलीच्या लग्नानंतर
MUDRA Yojana,Government,18-60,All,All,Below Poverty Line,Tamil Nadu,Microcredit for small/micro enterprises,Micro/small business owners or entrepreneurs with a viable business idea,Collateral-free loans up to INR 10 lakh,Application at bank branches or online through approved portals,https://mudra.org.in,Interest rate varies from 11% to 12% per annum,Up to 5 years,Varies based on loan amount,Monthly or quarterly,MUDRA Yojana,मनी योजना,छोटे/सूक्ष्म उद्यमों के लिए microcredit,लघु/सूक्ष्म उद्योगांसाठी मायक्रोक्रेडिट,एक व्यवहार्य व्यवसाय विचार के साथ सूक्ष्म/छोटे व्यवसाय के मालिक या उद्यमी,मायक्रो/स्मॉल बिझिनेस मालक किंवा व्यवहार्य व्यवसाय कल्पना असलेले उद्योजक,INR 10 लाख तक संपार्श्विक-मुक्त ऋण,10 लाख पर्यंत संपार्श्विक-मुक्त कर्ज,स्वीकृत पोर्टल्स के माध्यम से बैंक शाखाओं या ऑनलाइन पर आवेदन,मंजूर पोर्टलद्वारे बँक शाखांमध्ये किंवा ऑनलाइन अर्ज,ब्याज दर 11% से 12% प्रति वर्ष तक भिन्न होती है,व्याज दर वार्षिक 11% ते 12% पर्यंत बदलतो,5 साल तक,5 वर्षांपर्यंत
Pradhan Mantri Jan Dhan Yojana,Government,All,All,All,All,Kerala,Financial Inclusion & Banking Access,"All citizens of India, no minimum income requirement","Zero balance savings account, debit card, insurance",Visit bank branch or online registration,https://pmjdy.gov.in,Interest rate 10-15%,,,,Pradhan Mantri Jan Dhan Yojana,प्रधान मंत्र जान धन योजना,वित्तीय समावेशन और बैंकिंग पहुंच,आर्थिक समावेश आणि बँकिंग प्रवेश,"भारत के सभी नागरिक, कोई न्यूनतम आय आवश्यकता नहीं है","भारताचे सर्व नागरिक, किमान उत्पन्नाची आवश्यकता नाही","शून्य शेष बचत खाता, डेबिट कार्ड, बीमा","शून्य शिल्लक बचत खाते, डेबिट कार्ड, विमा",बैंक शाखा या ऑनलाइन पंजीकरण पर जाएँ,बँक शाखा किंवा ऑनलाइन नोंदणीला भेट द्या,ब्याज दर 5-8%,वार्षिक परतावा 5-7%,,
LIC Jeevan Utkarsh Policy,Private,18-60,All,All,Middle,Haryana,Life Insurance with Savings,All individuals seeking life coverage and savings,"Life insurance coverage, maturity benefits, savings component",Online or through LIC agents,https://licindia.in,"Maturity amount depends on premium and policy term, approx 6-8% interest rate internally",10-20 years,Premiums starting at INR 500/month,"Monthly, Quarterly, Annually",LIC Jeevan Utkarsh Policy,लाइव्ह लाइफ पॉलिसी,बचत के साथ जीवन बीमा,बचत सह जीवन विमा,जीवन कवरेज और बचत की मांग करने वाले सभी व्यक्ति,जीवनाचे कव्हरेज आणि बचत शोधत असलेल्या सर्व व्यक्ती,"जीवन बीमा कवरेज, परिपक्वता लाभ, बचत घटक","जीवन विमा संरक्षण, परिपक्वता लाभ, बचत घटक",ऑनलाइन या लाइसेंस एजेंटों के माध्यम से,ऑनलाईन किंवा एलआयसी एजंट्सद्वारे,"परिपक्वता राशि प्रीमियम और नीति अवधि पर निर्भर करती है, लगभग 6-8% ब्याज दर आंतरिक रूप से","परिपक्वता रक्कम प्रीमियम आणि पॉलिसी टर्मवर अवलंबून असते, अंदाजे 6-8% व्याज दर अंतर्गत",10-20 वर्ष,10-20 वर्षे
Post Office Monthly Income Scheme,Government,60+,All,All,All,Chhattisgarh,Pension & Income Security for Senior Citizens,Senior citizens of India,Monthly income with capital safety,Visit nearby post office with ID proof,https://indiapost.gov.in,Interest rate approx 7.4% per annum,6 years,,Monthly,डाकघर मासिक आय योजना,पोस्ट ऑफिस मासिक उत्पन्न योजना,वरिष्ठ नागरिकों के लिए पेंशन और आय सुरक्षा,ज्येष्ठ नागरिकांसाठी निवृत्तीवेतन आणि उत्पन्न सुरक्षा,भारत के वरिष्ठ नागरिक,भारताचे ज्येष्ठ नागरिक,पूंजी सुरक्षा के साथ मासिक आय,भांडवली सुरक्षेसह मासिक उत्पन्न,आईडी प्रूफ के साथ पास के डाकघर पर जाएँ,आयडी प्रूफसह जवळील पोस्ट ऑफिसला भेट द्या,ब्याज दर लगभग 7.4% प्रति वर्ष,व्याज दर दरवर्षी अंदाजे 7.4%,6 साल,6 वर्षे
Bharat QR for Digital Payments,Private,All,All,All,All,Eastern India,Promote Digital Payments,All citizens with a mobile device,"Easy digital transactions, cashless payments","Download BHIM app or other QR code scanning apps, scan merchant QR codes",https://npci.org.in,Annual return 5-7%,,,,डिजिट क्यूआर डिजिटल भुगतान के लिए,डिजिटल पेमेंटसाठी भारत क्यूआर,डिजिटल भुगतान को बढ़ावा देना,डिजिटल पेमेंट्सची जाहिरात करा,एक मोबाइल डिवाइस वाले सभी नागरिक,मोबाइल डिव्हाइससह सर्व नागरिक,"आसान डिजिटल लेनदेन, कैशलेस भुगतान","सुलभ डिजिटल व्यवहार, कॅशलेस पेमेंट्स","BHIM ऐप या अन्य QR कोड स्कैनिंग ऐप्स, स्कैन मर्चेंट QR कोड डाउनलोड करें","भिम अॅप किंवा इतर क्यूआर कोड स्कॅनिंग अ‍ॅप्स, स्कॅन मर्चंट क्यूआर कोड डाउनलोड करा",ब्याज दर 5-8%,वार्षिक परतावा 4-6%,,
Stand Up India Scheme,Government,18-60,All,SC,Middle,Jammu & Kashmir,Support SC/ST entrepreneurs,SC/ST entrepreneurs with viable business plans,"Loans up to INR 1 crore, mentorship support",Application through bank branches or online portals,https://standupmitra.in,Interest rate approx 9% per annum,5-7 years,Depends on loan amount,Monthly or quarterly,स्टैंड अप इंडिया स्कीम,उभे रहा भारत योजना,एससी/एसटी उद्यमियों का समर्थन करें,एससी/एसटी उद्योजकांना समर्थन द्या,व्यवहार्य व्यावसायिक योजनाओं के साथ SC/ST उद्यमी,व्यवहार्य व्यवसाय योजनांसह एससी/एसटी उद्योजक,"INR 1 करोड़ तक ऋण, मेंटरशिप सपोर्ट","1 कोटी पर्यंत कर्ज, मार्गदर्शक समर्थन",बैंक शाखाओं या ऑनलाइन पोर्टल्स के माध्यम से आवेदन,बँक शाखा किंवा ऑनलाइन पोर्टलद्वारे अर्ज,ब्याज दर लगभग 9% प्रति वर्ष,व्याज दर दरवर्षी अंदाजे 9%,5-7 साल,5-7 वर्षे
NREGA (Mahatma Gandhi National Rural Employment Guarantee Act),Government,18-60,All,All,Below Poverty Line,Delhi,Rural Employment & Income Security,Residents of rural areas eligible for work under NREGA,"Guaranteed wage employment, livelihood support",Application through local panchayats or employment offices,https://nrega.nic.in,Interest rate 6-8%,"As per work duration, typically 100 days/year",Wages at minimum wage rates,Weekly or Monthly,नरेगा (महात्मा गांधी राष्ट्रीय ग्रामीण रोजगार गारंटी अधिनियम),नरेगा (महात्मा गांधी राष्ट्रीय ग्रामीण रोजगार हमी कायदा),ग्रामीण रोजगार और आय प्रतिभूति,ग्रामीण रोजगार आणि उत्पन्न सुरक्षा,ग्रामीण क्षेत्रों के निवासी नरेगा के तहत काम के लिए पात्र हैं,ग्रामीण भागातील रहिवासी नरेगा अंतर्गत कामासाठी पात्र आहेत,"गारंटीकृत मजदूरी रोजगार, आजीविका समर्थन","हमी वेतन रोजगार, रोजीरोटी समर्थन",स्थानीय पंचायतों या रोजगार कार्यालयों के माध्यम से आवेदन,स्थानिक पंचायत किंवा रोजगार कार्यालयांद्वारे अर्ज,ब्याज दर 5-8%,व्याज दर 7-10%,"काम की अवधि के अनुसार, आमतौर पर 100 दिन/वर्ष","कामाच्या कालावधीनुसार, सामान्यत: 100 दिवस/वर्ष"
Pradhan Mantri Jan Dhan Yojana,Government,6-18,All,All,Below Poverty Line,Delhi,Banking Inclusion and Savings,Open to all residents of India,"Zero balance accounts, Debit cards, Overdraft facility","Visit a bank branch or online portal, submit ID proof and address proof",https://pmjdy.gov.in/,Annual return 6-9%,Lifetime,,,Pradhan Mantri Jan Dhan Yojana,प्रधान मंत्र जान धन योजना,बैंकिंग समावेशन और बचत,बँकिंगचा समावेश आणि बचत,भारत के सभी निवासियों के लिए खुला,भारताच्या सर्व रहिवाशांसाठी खुला,"शून्य शेष खाते, डेबिट कार्ड, ओवरड्राफ्ट सुविधा","शून्य शिल्लक खाती, डेबिट कार्ड, ओव्हरड्राफ्ट सुविधा","एक बैंक शाखा या ऑनलाइन पोर्टल पर जाएं, आईडी प्रूफ और एड्रेस प्रूफ सबमिट करें","बँक शाखा किंवा ऑनलाइन पोर्टलला भेट द्या, आयडी पुरावा आणि पत्ता पुरावा सबमिट करा",ब्याज दर 10-15%,व्याज दर 10-15%,जीवनभर,आजीवन
Mudra Yojana,Government,19-35,All,OBC,Below Poverty Line,Chhattisgarh,Microcredit for small businesses,"Small entrepreneurs, Self-help groups, Micro-enterprises",Access to collateral-free loans up to INR 10 lakh,"Online application or through bank branches, documentation of business plan",https://mudrayojana.bcrec.in/,Interest rate 7-9%,5 years,Variable depending on loan amount,Monthly or Quarterly,Mudra Yojana,पैसा योजना,छोटे व्यवसायों के लिए microcredit,छोट्या व्यवसायांसाठी मायक्रोक्रेडिट,"छोटे उद्यमी, स्व-सहायता समूह, माइक्रो-एंटरप्राइज","लहान उद्योजक, स्वत: ची मदत गट, सूक्ष्म-एन्टरप्राइझ",INR 10 लाख तक संपार्श्विक-मुक्त ऋण तक पहुंच,आयएनआर 10 लाख पर्यंत संपार्श्विक-मुक्त कर्जात प्रवेश,"ऑनलाइन आवेदन या बैंक शाखाओं के माध्यम से, व्यवसाय योजना का प्रलेखन","ऑनलाईन अर्ज किंवा बँक शाखांद्वारे, व्यवसाय योजनेचे दस्तऐवजीकरण",ब्याज दर 7-9%,व्याज दर 7-9%,5 साल,5 वर्षे
Sukanya Samriddhi Yojana,Government,0-18,Female,All,All,All,Child girl education and marriage savings,Girl child of parents/guardians in India,"Interest rate 7.6%, Tax benefits, Maturity after 21 years or on marriage after 18","Apply at banks or post offices, Submit birth certificate and ID proof",https://ssy.gov.in/,Interest rate 7.6% compounded annually,21 years or until marriage after 18,"Minimum INR 250, maximum INR 1.5 lakh annually",Monthly or Annual,Sukanya Samriddhi Yojana,सुकन्या साम्रिधी योजना,बाल लड़की शिक्षा और शादी की बचत,बाल मुलगी शिक्षण आणि विवाह बचत,भारत में माता -पिता/अभिभावकों की लड़की,भारतात पालक/पालकांची मुलगी/पालक,"ब्याज दर 7.6%, कर लाभ, 21 साल के बाद परिपक्वता या 18 के बाद विवाह पर","व्याज दर 7.6%, कर लाभ, 21 वर्षानंतर किंवा 18 नंतर लग्नानंतर परिपक्वता","बैंकों या डाकघरों में आवेदन करें, जन्म प्रमाण पत्र और आईडी प्रूफ सबमिट करें","बँक किंवा पोस्ट ऑफिसवर अर्ज करा, जन्म प्रमाणपत्र आणि आयडी पुरावा सबमिट करा",ब्याज दर 7.6% सालाना,व्याज दर दरवर्षी 7.6% चक्रवाढ,21 साल या 18 के बाद शादी तक,21 वर्षे किंवा 18 नंतर लग्न होईपर्यंत
Atal Pension Yojana,Government,19-60,All,All,Middle,All,Pension for workers in unorganized sectors,Subscribers aged 18-40 years with a valid Aadhaar number,"Monthly pension post retirement, Guaranteed minimum pension",Online registration through portal or via bank branches,https://www.atalpensionyojana.gov.in/,"Variable based on contribution, 8-9% interest rate projected",N/A (ongoing),"Variable based on contribution, minimum INR 100/month",Monthly,अटल पेंशन योजना,अटल पेन्शन योजना,असंगठित क्षेत्रों में श्रमिकों के लिए पेंशन,असंघटित क्षेत्रातील कामगारांसाठी पेन्शन,एक वैध आधार संख्या के साथ 18-40 वर्ष की आयु के ग्राहक,वैध आधार क्रमांकासह 18-40 वर्षे वयोगटातील ग्राहक,"मासिक पेंशन पोस्ट सेवानिवृत्ति, न्यूनतम पेंशन की गारंटी","मासिक पेन्शन पोस्ट सेवानिवृत्ती, हमी किमान पेन्शन",पोर्टल के माध्यम से या बैंक शाखाओं के माध्यम से ऑनलाइन पंजीकरण,पोर्टलद्वारे किंवा बँक शाखांद्वारे ऑनलाइन नोंदणी,"योगदान के आधार पर परिवर्तनीय, 8-9% ब्याज दर अनुमानित","योगदानाच्या आधारे व्हेरिएबल, 8-9% व्याज दर अंदाजित",एन/ए (चल रहा),एन/ए (चालू आहे)
Credit Guarantee Fund Trust for Micro and Small Enterprises,Government,All,All,All,All,All,Guarantee for micro and small enterprise loans,Micro and small enterprises seeking credit,"Loan collateral support, Risk coverage for lenders","Application via participating banks, submission of enterprise details",https://www.cgtsme.in/,Annual return 6-9%,,,,माइक्रो और छोटे उद्यमों के लिए क्रेडिट गारंटी फंड ट्रस्ट,सूक्ष्म आणि लहान उपक्रमांसाठी पत हमी फंड ट्रस्ट,सूक्ष्म और छोटे उद्यम ऋण के लिए गारंटी,सूक्ष्म आणि लहान एंटरप्राइझ कर्जाची हमी,माइक्रो और छोटे उद्यमों को क्रेडिट मांगने वाला,क्रेडिट शोधणारे सूक्ष्म आणि छोटे उपक्रम,"ऋण संपार्श्विक समर्थन, उधारदाताओं के लिए जोखिम कवरेज","कर्ज संपार्श्विक समर्थन, सावकारांसाठी जोखीम कव्हरेज","भाग लेने वाले बैंकों के माध्यम से आवेदन, उद्यम विवरण प्रस्तुत करना","सहभागी बँकांद्वारे अर्ज, एंटरप्राइझ तपशील सादर करणे",ब्याज दर 6-8%,वार्षिक परतावा 4-6%,,
