scheme_name,scheme_type,age_group,gender,social_category,annual_income_group,location,scheme_goal,eligibility,benefits,application_process,scheme_website,total_returns,time_duration,amount_to_be_paid,payment_interval,scheme_name_hi,scheme_name_mr,scheme_goal_hi,scheme_goal_mr,eligibility_hi,eligibility_mr,benefits_hi,benefits_mr,application_process_hi,application_process_mr,total_returns_hi,total_returns_mr,time_duration_hi,time_duration_mr
Janashree Bima Yojana,Government,19-35,All,All,Below Poverty Line,South India,Insurance,Any citizen below poverty line,Accident and death insurance cover,Apply through local banks or insurance offices,http://janashreebima.gov.in,Annual return 4-6%,1 year,,,सार्वजनिक किरण योजना,सार्वजनिक बीम योजना,बीमा,विमा,गरीबी रेखा से नीचे कोई भी नागरिक,दारिद्र्य रेषेखालील कोणताही नागरिक,दुर्घटना और मृत्यु बीमा कवर,अपघात आणि मृत्यू विमा संरक्षण,स्थानीय बैंकों या बीमा कार्यालयों के माध्यम से आवेदन करें,स्थानिक बँका किंवा विमा कार्यालयांद्वारे अर्ज करा,वार्षिक रिटर्न 5-7%,वार्षिक परतावा 4-6%,1 वर्ष,1 वर्ष
Pradhan Mantri Awas Yojana,Government,All,All,All,Below Poverty Line,Rajasthan,Housing,Low income families,Housing subsidy and financial assistance,Online application or local government office,http://pmay.gov.in,Annual return 4-6%,,,,Pradhan Mantri Awas Yojana,पंतप्रधान गृहनिर्माण योजना,आवास,गृहनिर्माण,कम आय वाले परिवार,कमी उत्पन्न कुटुंब,आवास सब्सिडी और वित्तीय सहायता,गृहनिर्माण अनुदान आणि आर्थिक सहाय्य,ऑनलाइन आवेदन या स्थानीय सरकारी कार्यालय,ऑनलाइन अर्ज किंवा स्थानिक शासकीय कार्यालय,ब्याज दर 8-12%,वार्षिक परतावा 5-7%,,
Micro Units Development Scheme,Private,36-60,All,OBC,Middle,Uttar Pradesh,Microcredit,Micro-entrepreneurs,Access to microloans for small business,Visit local microfinance institutions,http://mudra.org.in,Interest rate 12-15%,5 years,"Up to 50,000 INR",Monthly,माइक्रो यूनिट विकास योजना,मायक्रो युनिट्स डेव्हलपमेंट स्कीम,माइक्रोक्रेडिट,मायक्रोक्रेडिट,माइक्रो-उद्यमियों,मायक्रो-एन्ट्रीप्रेनर्स,छोटे व्यवसाय के लिए माइक्रोलोन तक पहुंच,छोट्या व्यवसायासाठी मायक्रोलोन्समध्ये प्रवेश,स्थानीय माइक्रोफाइनेंस संस्थानों पर जाएं,स्थानिक मायक्रोफायनान्स संस्थांना भेट द्या,ब्याज दर 12-15%,व्याज दर 12-15%,5 साल,5 वर्षे
National Pension Scheme,Government,60+,All,All,Upper,Delhi,Pension,Salaried individuals over 60,Monthly pension benefits,Register through authorized banks,http://npstrust.org.in,"Interest rate varies, 8-10% estimated",Lifetime,,Monthly,राष्ट्रीय पेंशन योजना,राष्ट्रीय पेन्शन योजना,पेंशन,पेन्शन,60 से अधिक लोगों को वेतनभोगी,60 पेक्षा जास्त पगारदार व्यक्ती,मासिक पेंशन लाभ,मासिक पेन्शन लाभ,अधिकृत बैंकों के माध्यम से पंजीकरण करें,अधिकृत बँकांद्वारे नोंदणी करा,"ब्याज दर भिन्न होती है, 8-10% अनुमानित","व्याज दर बदलतो, अंदाजे 8-10%",जीवनभर,आजीवन
Digital Financial Literacy Program,Government,19-35,All,All,All,Delhi,Financial Literacy,Open to all residents,Enhanced financial awareness and literacy,Online registration,http://finlit.gov.in,Annual return 4-6%,6 months,,,अंकीय वित्तीय साक्षरता कार्यक्रम,डिजिटल आर्थिक साक्षरता कार्यक्रम,वित्तीय साक्षरता,आर्थिक साक्षरता,सभी निवासियों के लिए खुला,सर्व रहिवाशांसाठी उघडा,बढ़ी हुई वित्तीय जागरूकता और साक्षरता,वर्धित आर्थिक जागरूकता आणि साक्षरता,ऑनलाइन पंजीकरण,ऑनलाइन नोंदणी,वार्षिक रिटर्न 5-7%,वार्षिक परतावा 4-6%,6 महीने,6 महिने
Small Savings Deposit Scheme,Government,All,All,All,All,Gujarat,Savings,Any individual,Interest income and savings growth,Visit post offices or banks,http://savings.gov.in,Interest rate 4-7%,,Minimum 100 INR,One-time or N/A,अल्प बचत जमा योजना,लहान बचत ठेव योजना,बचत,बचत,कोई व्यक्ति,कोणतीही व्यक्ती,ब्याज आय और बचत वृद्धि,व्याज उत्पन्न आणि बचत वाढ,डाकघर या बैंकों पर जाएँ,पोस्ट ऑफिस किंवा बँकांना भेट द्या,ब्याज दर 4-7%,व्याज दर 4-7%,,
Women Self-Help Groups Funding,Private,19-60,Female,OBC,Middle,Jammu & Kashmir,Microcredit and empowerment,Women in SHGs,Access to loans and capacity building,Apply through local SHG federation,http://shgfund.org.in,Interest rate 10-14%,3 years,Up to 2 lakh INR,Monthly,महिला स्व-सहायता समूह वित्त पोषण,महिला स्वयं-मदत गट निधी,माइक्रोक्रेडिट और सशक्तीकरण,मायक्रोक्रेडिट आणि सशक्तीकरण,SHGs में महिलाएं,एसएचजी मध्ये महिला,ऋण और क्षमता निर्माण तक पहुंच,कर्ज आणि क्षमता इमारतीत प्रवेश,स्थानीय SHG महासंघ के माध्यम से आवेदन करें,स्थानिक एसएचजी फेडरेशनद्वारे अर्ज करा,ब्याज दर 10-14%,व्याज दर 10-14%,3 वर्ष,3 वर्षे
Senior Citizens Savings Scheme,Government,60+,All,All,All,Delhi,Savings and Retirement Planning,Senior citizens,Interest income with tax benefits,Apply at banks or post offices,http://savingsscheme.gov.in,Interest rate 7.4%,5 years,Minimum 1000 INR,Quarterly,वरिष्ठ नागरिक बचत योजना,ज्येष्ठ नागरिक बचत योजना,बचत और सेवानिवृत्ति योजना,बचत आणि सेवानिवृत्तीचे नियोजन,वरिष्ठ नागरिकों,ज्येष्ठ नागरिक,कर लाभों के साथ ब्याज आय,कर लाभासह व्याज उत्पन्न,बैंकों या डाकघरों में आवेदन करें,बँक किंवा पोस्ट ऑफिसवर अर्ज करा,ब्याज दर 7.4%,व्याज दर 7.4%,5 साल,5 वर्षे
Rural Business Development Fund,Private,36-60,All,SC,Middle,Uttar Pradesh,Microcredit and Business Development,Small rural entrepreneurs,Low-interest loans for business growth,Application at designated rural banks,http://ruralbank.org.in,Interest rate 9-11%,4 years,Up to 10 lakh INR,Monthly,ग्रामीण व्यवसाय विकास निधि,ग्रामीण व्यवसाय विकास निधी,माइक्रोक्रेडिट एंड बिजनेस डेवलपमेंट,मायक्रोक्रेडिट आणि व्यवसाय विकास,छोटे ग्रामीण उद्यमी,लहान ग्रामीण उद्योजक,व्यापार विकास के लिए कम ब्याज ऋण,व्यवसाय वाढीसाठी कमी व्याज कर्ज,नामित ग्रामीण बैंकों में आवेदन,नियुक्त केलेल्या ग्रामीण बँकांमध्ये अर्ज,ब्याज दर 9-11%,व्याज दर 9-11%,4 साल,4 वर्षे
Educational Loan Scheme for Minority Students,Government,19-35,All,Minority,Below Poverty Line,Haryana,Education,Minority students pursuing higher education,Educational loans with subsidized interest,Application through designated banks,http://eduloan.gov.in,Interest rate 5-8%,,Up to 20 lakh INR,Monthly,अल्पसंख्यक छात्रों के लिए शैक्षिक ऋण योजना,अल्पसंख्याक विद्यार्थ्यांसाठी शैक्षणिक कर्ज योजना,शिक्षा,शिक्षण,उच्च शिक्षा का पीछा करने वाले अल्पसंख्यक छात्र,अल्पसंख्याक विद्यार्थी उच्च शिक्षण घेतात,सब्सिडी वाले ब्याज के साथ शैक्षिक ऋण,अनुदानित स्वारस्यासह शैक्षणिक कर्ज,नामित बैंकों के माध्यम से आवेदन,नियुक्त केलेल्या बँकांद्वारे अर्ज करा,ब्याज दर 5-8%,व्याज दर 5-8%,,
Start-up Incubation Support,Private,19-35,All,All,Middle,Telangana,Entrepreneurship and Innovation,Start-ups and entrepreneurs,"Funding, mentorship, and infrastructure support",Online application through official portal,http://startup.in,Annual return 4-6%,,,,स्टार्ट-अप ऊष्मायन समर्थन,स्टार्ट-अप इनक्युबेशन समर्थन,उद्यमशीलता और नवाचार,उद्योजकता आणि नाविन्य,स्टार्ट-अप और उद्यमी,स्टार्ट-अप आणि उद्योजक,"फंडिंग, मेंटरशिप और इन्फ्रास्ट्रक्चर सपोर्ट","निधी, मार्गदर्शन आणि पायाभूत सुविधा समर्थन",आधिकारिक पोर्टल के माध्यम से ऑनलाइन आवेदन,अधिकृत पोर्टलद्वारे ऑनलाइन अर्ज,ब्याज दर 6-8%,व्याज दर 6-8%,,
Agricultural Insurance Scheme,Government,19-60,All,All,All,Punjab,Insurance,Farmers and agricultural workers,Crop loss coverage and compensation,File claim at local agriculture office,http://agriinsurance.gov.in,Annual return 6-9%,,Premiums vary,Annual,कृषि बीमा योजना,कृषी विमा योजना,बीमा,विमा,किसान और कृषि कार्यकर्ता,शेतकरी आणि कृषी कामगार,फसल हानि कवरेज और मुआवजा,पीक तोटा कव्हरेज आणि भरपाई,स्थानीय कृषि कार्यालय में फाइल का दावा,स्थानिक कृषी कार्यालयात दावा दाखल करा,वार्षिक रिटर्न 4-6%,व्याज दर 5-8%,,
Health Coverage for Low-Income Families,Government,"0-5,6-18,19-35,36-60,60+",All,All,Below Poverty Line,Western India,Health Insurance,Low-income families,Free or subsidized health services,Register at local health centers,http://healthcoverage.gov.in,Interest rate 7-10%,,,,कम आय वाले परिवारों के लिए स्वास्थ्य कवरेज,कमी उत्पन्न असलेल्या कुटुंबांसाठी आरोग्य कव्हरेज,स्वास्थ्य बीमा,आरोग्य विमा,कम आय वाले परिवार,कमी उत्पन्न असलेली कुटुंबे,नि: शुल्क या सब्सिडी वाली स्वास्थ्य सेवाएं,विनामूल्य किंवा अनुदानित आरोग्य सेवा,स्थानीय स्वास्थ्य केंद्रों पर पंजीकरण करें,स्थानिक आरोग्य केंद्रांवर नोंदणी करा,ब्याज दर 5-8%,व्याज दर 10-15%,,
Private Investment in Rural Banking,Private,36-60,All,All,Upper,Chhattisgarh,Banking and Investment,Private investors,Enhanced rural banking infrastructure,Direct investment or partnership,http://ruralbankinvestment.org.in,Interest rate 8-10%,2 years,Varies by investment,,ग्रामीण बैंकिंग में निजी निवेश,ग्रामीण बँकिंगमधील खासगी गुंतवणूक,बैंकिंग और निवेश,बँकिंग आणि गुंतवणूक,निजी निवेशक,खाजगी गुंतवणूकदार,बढ़ाया ग्रामीण बैंकिंग अवसंरचना,वर्धित ग्रामीण बँकिंग पायाभूत सुविधा,प्रत्यक्ष निवेश या साझेदारी,थेट गुंतवणूक किंवा भागीदारी,ब्याज दर 8-10%,व्याज दर 8-10%,2 साल,2 वर्षे
Skill Development Initiative for Youth,Government,19-35,All,All,All,Gujarat,Skill Development,Youth seeking employment or skill upgrade,Training and certification support,Online registration or local centers,http://skills.gov.in,Annual return 5-7%,6 months to 2 years,,,युवाओं के लिए कौशल विकास पहल,तरुणांसाठी कौशल्य विकास उपक्रम,कौशल विकास,कौशल्य विकास,रोजगार या कौशल उन्नयन की मांग करने वाले युवा,रोजगार किंवा कौशल्य अपग्रेड शोधत असलेले तरुण,प्रशिक्षण और प्रमाणन समर्थन,प्रशिक्षण आणि प्रमाणपत्र समर्थन,ऑनलाइन पंजीकरण या स्थानीय केंद्र,ऑनलाइन नोंदणी किंवा स्थानिक केंद्रे,ब्याज दर 8-12%,व्याज दर 9-13%,6 महीने से 2 साल तक,6 महिने ते 2 वर्षे
Urban Microfinance Program,Private,19-60,All,All,Middle,Madhya Pradesh,Microcredit,Urban micro-entrepreneurs,Small loans for business expansion,Apply through microfinance institutions,http://urbanmicrofinance.org.in,Interest rate 12-15%,3 years,Up to 3 lakh INR,Monthly,शहरी माइक्रोफाइनेंस प्रोग्राम,शहरी मायक्रोफायनान्स प्रोग्राम,माइक्रोक्रेडिट,मायक्रोक्रेडिट,शहरी सूक्ष्म उद्यमियों,शहरी मायक्रो-एन्ट्रीप्रेनर्स,व्यापार विस्तार के लिए छोटे ऋण,व्यवसाय विस्तारासाठी लहान कर्ज,माइक्रोफाइनेंस संस्थानों के माध्यम से लागू करें,मायक्रोफायनान्स संस्थांद्वारे अर्ज करा,ब्याज दर 12-15%,व्याज दर 12-15%,3 वर्ष,3 वर्षे
Jan Dhan Yojana,Government,19-35,All,All,Below Poverty Line,Kerala,Savings and Financial Inclusion,All Indian citizens above 10 years of age with valid identity proof,"Zero balance accounts, insurance, and debit cards",Visit nearby bank branch or KYC online,https://www.pmjdy.gov.in,Annual return 5-7%,Lifetime,,,Jan Dhan Yojana,जान धन योजना,बचत और वित्तीय समावेश,बचत आणि आर्थिक समावेश,वैध पहचान प्रमाण के साथ 10 वर्ष से अधिक आयु के सभी भारतीय नागरिक,वैध ओळख पुराव्यासह 10 वर्षांपेक्षा जास्त वयाच्या सर्व भारतीय नागरिकांना,"शून्य बैलेंस अकाउंट्स, इंश्योरेंस और डेबिट कार्ड","शून्य शिल्लक खाती, विमा आणि डेबिट कार्ड",पास के बैंक शाखा या KYC ऑनलाइन पर जाएं,जवळपासची बँक शाखा किंवा केवायसी ऑनलाईन भेट द्या,ब्याज दर 8-12%,व्याज दर 7-10%,जीवनभर,आजीवन
Pradhan Mantri Awas Yojana,Government,36-60,All,All,Middle,Bihar,Housing for All,"EWS, LIG, MIG categories, with income proof",Subsidized loans and financial assistance for housing,Apply through local government offices or online portal,https://www.mohua.gov.in,Annual return 5-7%,Up to 20 years,Subsidized interest rates,Monthly,Pradhan Mantri Awas Yojana,पंतप्रधान गृहनिर्माण योजना,सभी के लिए आवास,सर्वांसाठी घरे,"आय प्रमाण के साथ EWS, LIG, MIG श्रेणियां","उत्पन्नाच्या पुराव्यासह ईडब्ल्यूएस, लिग, एमआयजी श्रेण्या",सब्सिडी वाले ऋण और आवास के लिए वित्तीय सहायता,गृहनिर्माण कर्ज आणि आर्थिक सहाय्य,स्थानीय सरकारी कार्यालयों या ऑनलाइन पोर्टल के माध्यम से आवेदन करें,स्थानिक सरकारी कार्यालये किंवा ऑनलाइन पोर्टलद्वारे अर्ज करा,वार्षिक रिटर्न 5-7%,व्याज दर 10-15%,20 साल तक,20 वर्षांपर्यंत
Sukanya Samriddhi Yojana,Government,0-18,Female,All,All,Bihar,Child Education and Marriage Fund,Parents or guardians of girl child,"Tax benefits, high interest rate, maturity benefits",Open account at designated bank or post office,https://sukanyayojana.com,Interest rate 7.6% p.a.,Until girl turns 21 or 18 for marriage,Minimum Rs.250/year,Yearly,Sukanya Samriddhi Yojana,सुकन्या साम्रिधी योजना,बाल शिक्षा और विवाह निधि,बाल शिक्षण आणि विवाह निधी,लड़की के माता -पिता या अभिभावक बच्चे,पालक किंवा मुलगी मुलाचे पालक,"कर लाभ, उच्च ब्याज दर, परिपक्वता लाभ","कर लाभ, उच्च व्याज दर, परिपक्वता लाभ",निर्दिष्ट बैंक या डाकघर में खाता खुला,नियुक्त बँक किंवा पोस्ट ऑफिसवर ओपन खाते,ब्याज दर 7.6% पी.ए.,व्याज दर 7.6% पी.ए.,जब तक लड़की शादी के लिए 21 या 18 साल की हो जाती है,जोपर्यंत मुलगी लग्नासाठी 21 किंवा 18 वर्षांची होत नाही
Apna Digital Saksharta Abhiyan,Government,All,All,All,All,Assam,Digital Literacy,All citizens above 14 years of age,"Digital skills training, internet access points",Register at local Digital Literacy centers,https://digitalliteracy.gov.in,Annual return 4-6%,3 months to 1 year,,,Apna Digital Saksharta Abhiyan,आपली डिजिटल साक्षरता मोहीम,अंकीय साक्षरता,डिजिटल साक्षरता,14 वर्ष से अधिक आयु के सभी नागरिक,14 वर्षांपेक्षा जास्त वयाचे सर्व नागरिक,"डिजिटल कौशल प्रशिक्षण, इंटरनेट एक्सेस पॉइंट्स","डिजिटल कौशल्य प्रशिक्षण, इंटरनेट प्रवेश गुण",स्थानीय डिजिटल साक्षरता केंद्रों पर पंजीकरण करें,स्थानिक डिजिटल साक्षरता केंद्रांवर नोंदणी करा,ब्याज दर 9-13%,व्याज दर 7-10%,3 महीने से 1 वर्ष तक,3 महिने ते 1 वर्ष
Microfinance for Women,Private,19-60,Female,OBC,Below Poverty Line,Chhattisgarh,Microcredit for Women Entrepreneurs,Women with business plan or small enterprise,"Low-interest microloans, skill development support",Application at local microfinance institutions or online,https://microfinance.org.in,Interest rates 12-15% p.a.,1-3 years,Monthly installments,Monthly,महिलाओं के लिए माइक्रोफाइनेंस,महिलांसाठी मायक्रोफायनान्स,महिला उद्यमियों के लिए microcredit,महिला उद्योजकांसाठी मायक्रोक्रेडिट,व्यवसाय योजना या छोटे उद्यम वाली महिलाएं,व्यवसाय योजना किंवा लहान उपक्रम असलेल्या महिला,"कम-ब्याज वाले माइक्रोलोन, कौशल विकास सहायता","कमी व्याज मायक्रोलोन्स, कौशल्य विकास समर्थन",स्थानीय माइक्रोफाइनेंस संस्थानों या ऑनलाइन पर आवेदन,स्थानिक मायक्रोफायनान्स संस्था किंवा ऑनलाइन येथे अर्ज,ब्याज दरें 12-15% पी.ए.,व्याज दर 12-15% पी.ए.,1-3 साल,1-3 वर्षे
